Post Title,Post Description,Posted User,Posted Date
Permanently Deleting Models,"Sometimes you may need to truly remove a model from your database. To permanently remove a soft deleted model from the database, use the forceDelete method:",User 9,6/10/2019 4:59
Restoring Soft Deleted Models,"Sometimes you may wish to ""un-delete"" a soft deleted model. To restore a soft deleted model into an active state, use the restore method on a model instance:",User 9,6/10/2019 4:49
Including Soft Deleted Models,"As noted above, soft deleted models will automatically be excluded from query results. However, you may force soft deleted models.",User 8,6/10/2019 4:29
Deleting An Existing Model By Key,"In the example above, we are retrieving the model from the database before calling the delete method. However, if you know the primary key of the model.",User 9,6/10/2019 4:05
Deleting Models By Query,"You can also run a delete statement on a set of models. In this example, we will delete all flights that are marked as inactive. Like mass updates, mass deletes will not fire any model events for the models that are deleted:",User 9,6/10/2019 4:01
success massage not working.,"Hello everyone am a newly in laravel and am using laravel 5.5 , success massage not working. am pass this in controller",User 9,6/10/2019 3:53
Soft Deleting,"In addition to actually removing records from your database, Eloquent can also ""soft delete"" models. When models are soft deleted, they are not actually removed from your database.",User 9,6/10/2019 3:25
This is Admin 2 's post title,While working with data we come across different data formats. workk work.,Admin 2,6/7/2019 10:09
This is User 2 's post 1 title,"I'm trying to export the table ""formal"", to a simple excel file.
This post is updated by User 1",User 2,6/3/2019 10:02
This is Admin's post,This is admin's post 1 description. Updated by User1.,Admin,5/29/2019 14:51
This is User1's post 2,This is User1's post 2 description.,User1,5/30/2019 7:59
This is User's post,This is user1's post 1 description. Updated by Admin.,User1,5/29/2019 14:51
eos,Ut amet porro porro distinctio quia nam est.,User1,5/29/2019 8:23
architecto,At veritatis eligendi nisi velit totam omnis.,User 7,5/29/2019 8:23
minus,Omnis ipsa exercitationem veritatis repudiandae nisi ut velit voluptas.,User 5,5/29/2019 8:23
quia,Error reprehenderit aut perferendis eum quos ea.,User 7,5/29/2019 8:23
quibusdam,Ab quia qui ut dolores aperiam omnis dolore.,User1,5/29/2019 8:23
tenetur,Asperiores qui qui occaecati quaerat.,User 3,5/29/2019 8:23
et,Corrupti consequuntur magni id laudantium sit.,User 2,5/29/2019 8:23
quam,Quo cumque voluptatem recusandae itaque possimus natus.,User 8,5/29/2019 8:23
eligendi,Et eos ipsam provident laborum sit ut est.,User 7,5/29/2019 8:23
incidunt,Quia labore corporis magni non distinctio quis commodi.,User 4,5/29/2019 8:23
qui,Nihil ad consectetur voluptas explicabo.,User 8,5/29/2019 8:23
eos,Dolor placeat officiis sequi est.,User 4,5/29/2019 8:23
vel,Tempora tenetur non ut numquam molestiae.,User 8,5/29/2019 8:23
fugiat,Vero laboriosam et temporibus voluptatum neque ipsam.,User 5,5/29/2019 8:23
qui,Enim cupiditate voluptas voluptatem sit.,Admin,5/29/2019 8:23
sed,Quod exercitationem rem occaecati omnis sit nemo dolorem cum.,User 6,5/29/2019 8:23
sunt,Asperiores laboriosam possimus sunt et quis.,User 7,5/29/2019 8:23
facilis,Corporis vero nemo facilis natus ducimus voluptatum qui voluptas.,Admin,5/29/2019 8:23
harum,Neque rerum asperiores ut nisi id voluptate.,User 7,5/29/2019 8:23
at,Quia et quis fuga fugit qui aut.,User 7,5/29/2019 8:23
quo,Ut et libero aut quibusdam.,User 8,5/29/2019 8:23
consequuntur,Aspernatur optio nulla quia amet quia atque voluptatem.,Admin,5/29/2019 8:23
delectus,Eius totam ullam praesentium ea molestiae consequatur rerum.,User 3,5/29/2019 8:23
voluptatem,Id necessitatibus dicta vel aliquid a minus.,User 5,5/29/2019 8:23
enim,Animi praesentium voluptatem impedit consequatur ipsum enim totam quia.,User 5,5/29/2019 8:23
perferendis,Et dignissimos qui repudiandae quidem et nobis commodi ducimus.,User1,5/29/2019 8:23
ut,Vel et et ratione voluptate.,User 8,5/29/2019 8:23
ipsam,Aspernatur quam ut minima voluptas itaque maxime.,User 7,5/29/2019 8:23
dolor,Quidem rem eum voluptate vitae.,Admin,5/29/2019 8:23
iure,Perferendis sint cumque id voluptatibus odit sed.,User 2,5/29/2019 8:23
asperiores,Voluptatem praesentium qui qui velit rerum cupiditate animi.,User 7,5/29/2019 8:23
est,Similique fugiat atque architecto aspernatur excepturi ut qui.,User 2,5/29/2019 8:23
fugiat,Voluptatem expedita atque eos accusamus.,User 7,5/29/2019 8:23
doloribus,Sunt consequatur tempora suscipit quam placeat vitae dolorem.,User 5,5/29/2019 8:23
laboriosam,Itaque in nisi debitis quis mollitia optio accusantium.,Admin,5/29/2019 8:23
officia,Laboriosam nisi tempore earum dolor ab.,User1,5/29/2019 8:23
molestiae,Ut repellendus nulla corporis qui placeat.,User1,5/29/2019 8:23
quia,Et eos reprehenderit consectetur ratione vero veritatis.,User 5,5/29/2019 8:23
voluptatem,Qui numquam recusandae rerum qui.,User 3,5/29/2019 8:23
quod,Deleniti doloribus est sint est qui.,User 5,5/29/2019 8:23
qui,Vel ipsa recusandae non tempora harum excepturi ducimus.,User 3,5/29/2019 8:23
consectetur,Architecto sint qui corporis aut suscipit dolorem.,User 6,5/29/2019 8:23
qui,Debitis molestias deleniti voluptatem id aut ipsa non.,User 7,5/29/2019 8:23
omnis,Ullam enim quis consequatur eum possimus dignissimos veritatis.,User 4,5/29/2019 8:23
tempore,Maiores quo dolorem repudiandae ut.,User 8,5/29/2019 8:23
autem,Deleniti autem quaerat eligendi molestias sit.,User 7,5/29/2019 8:23
velit,Officia voluptatem et veritatis.,User1,5/29/2019 8:23
quod,Debitis nihil consequatur alias qui cumque.,Admin,5/29/2019 8:23
laboriosam,Voluptatum iste et sint perspiciatis ut modi.,User1,5/29/2019 8:23
velit,Et aut consequatur ex eos dignissimos.,User 6,5/29/2019 8:23
porro,Dolor necessitatibus sed saepe qui cum.,User 3,5/29/2019 8:23
omnis,Sed consequuntur animi incidunt eos.,Admin,5/29/2019 8:23
quia,Unde ducimus qui quae enim ut quasi.,User1,5/29/2019 8:23
voluptatem,Voluptatem nostrum tenetur eos voluptatem veniam sunt et eum.,User 2,5/29/2019 8:23
temporibus,Temporibus delectus adipisci voluptate rerum aut vel quos.,User 2,5/29/2019 8:23
voluptas,Adipisci placeat ipsum veritatis maiores totam.,User 3,5/29/2019 8:23
occaecati,Possimus numquam debitis eos dolor et molestiae.,User 2,5/29/2019 8:23
unde,Est aut dolor perferendis illum cum dolore eum.,User 7,5/29/2019 8:23
laboriosam,Quidem architecto id eos.,User 2,5/29/2019 8:23
sed,Repudiandae quis ut beatae recusandae et.,Admin,5/29/2019 8:23
ad,Totam architecto temporibus et atque perspiciatis eos.,User 4,5/29/2019 8:23
nobis,Consequatur nemo et impedit officia.,User 2,5/29/2019 8:23
vero,Praesentium quod est autem unde.,User 4,5/29/2019 8:23
similique,Omnis quam aspernatur sit veniam magnam adipisci.,User 7,5/29/2019 8:23
dolore,Voluptatem natus omnis quisquam aut culpa iste.,User 8,5/29/2019 8:23
rerum,Id velit sit nostrum.,User 5,5/29/2019 8:23
quo,Blanditiis odio fuga sed itaque cupiditate quis mollitia.,User 8,5/29/2019 8:23
itaque,Optio quia nam quis omnis.,User 2,5/29/2019 8:23
maiores,Ipsam eaque reiciendis voluptatem.,User 6,5/29/2019 8:23
est,Unde quis distinctio architecto ipsa.,User 2,5/29/2019 8:23
est,Voluptas iure dolorem sint unde vitae consequatur enim magnam.,User1,5/29/2019 8:23
dolore,Nesciunt facere doloremque laborum alias.,User 8,5/29/2019 8:23
consequatur,Iure ipsam ratione perspiciatis veritatis fugiat.,Admin,5/29/2019 8:23
saepe,Est eos excepturi fugit doloribus dolor consectetur.,Admin,5/29/2019 8:23
sit,Eos voluptatem facilis non sit dolorem suscipit.,User 2,5/29/2019 8:23
facilis,Voluptatem eum hic qui voluptas.,User 4,5/29/2019 8:23
qui,Modi et est explicabo impedit aut.,User 3,5/29/2019 8:23
omnis,Excepturi non ab delectus saepe natus.,User 2,5/29/2019 8:23
illum,Eaque odio harum consequatur cum.,User 3,5/29/2019 8:23
placeat,Veniam ipsam reprehenderit ut vel dicta atque.,User 4,5/29/2019 8:23
culpa,Nostrum et aliquam molestiae cum.,User 2,5/29/2019 8:23
debitis,Consequatur temporibus aut impedit nostrum rerum praesentium.,User 2,5/29/2019 8:23
veniam,Qui nulla necessitatibus aut qui temporibus qui adipisci qui.,User 5,5/29/2019 8:23
rerum,Ut ut fugit consequuntur est et.,User 2,5/29/2019 8:23
assumenda,Error perspiciatis fugiat et expedita sit rerum et.,User1,5/29/2019 8:23
odit,Et consequatur sit quia asperiores et veniam praesentium.,User 6,5/29/2019 8:23
et,A iusto dolor quae reprehenderit.,User 4,5/29/2019 8:23
harum,Autem ratione molestiae qui atque consequatur fugit.,User 4,5/29/2019 8:23
quibusdam,Ratione quis eum sint itaque laudantium voluptas corporis.,User 4,5/29/2019 8:23
ut,Distinctio nemo eum ut earum qui iste.,User 8,5/29/2019 8:23
ullam,Ut quam architecto et ut tempora.,User1,5/29/2019 8:23
non,Architecto eum ut voluptatem nesciunt repellat eum sed.,User 5,5/29/2019 8:23
maxime,Non dicta dolor architecto quis nostrum tempore vel aliquam.,User1,5/29/2019 8:23
et,Velit tempore earum ipsa iste ratione impedit quisquam eligendi.,User1,5/29/2019 8:23
neque,Odit maxime similique est sed iure dolorem.,User 8,5/29/2019 8:23
qui,Aperiam eaque alias repellat eius totam nisi.,User 8,5/29/2019 8:23
rerum,Voluptatum repudiandae omnis impedit iste nostrum laudantium.,User 6,5/29/2019 8:23
omnis,Aspernatur laudantium numquam officiis non ipsum commodi.,User 8,5/29/2019 8:23
id,Non voluptatem aut quae accusamus repudiandae praesentium quia.,Admin,5/29/2019 8:23
placeat,Sed aut non et ipsa quia aut.,User 6,5/29/2019 8:23
sit,Blanditiis deleniti qui voluptatem et sapiente sapiente dolorem.,User 8,5/29/2019 8:23
unde,Odio explicabo sit quia harum voluptas mollitia.,User 2,5/29/2019 8:23
officiis,Pariatur animi mollitia quis.,User1,5/29/2019 8:23
quisquam,Inventore sit voluptatem quas adipisci.,User 4,5/29/2019 8:23
minima,Veniam voluptatibus cum necessitatibus modi odit sint.,User 5,5/29/2019 8:23
illo,Accusantium eligendi qui illo illo praesentium.,User 6,5/29/2019 8:23
qui,Tenetur et qui asperiores eaque aut et.,User 6,5/29/2019 8:23
ut,Qui optio dolores id et nihil dolor dolorem.,User 5,5/29/2019 8:23
amet,Repellendus id in fugit quam similique repellat necessitatibus.,User 2,5/29/2019 8:23
sed,Odit non nihil maiores aut dolores.,User 3,5/29/2019 8:23
aut,Alias voluptatum possimus et unde libero.,User 2,5/29/2019 8:23
facilis,Labore voluptatem esse vitae quo architecto hic.,User 4,5/29/2019 8:23
accusantium,Impedit perferendis ut corporis dolores ut ipsam dolor.,User 7,5/29/2019 8:23
numquam,Eaque vel officiis officiis aut aut perferendis.,User 6,5/29/2019 8:23
saepe,Consequatur placeat et illum natus dolorum perspiciatis.,User 7,5/29/2019 8:23
rem,Numquam reprehenderit qui aut ut nisi dolores.,User 3,5/29/2019 8:23
tempora,Facilis neque ex laborum eveniet minima.,User 7,5/29/2019 8:23
nostrum,Qui tempore voluptatem minima non nostrum est facilis.,User 4,5/29/2019 8:23
quisquam,Esse omnis adipisci autem dolor natus dolores adipisci.,User 2,5/29/2019 8:23
et,Cupiditate distinctio sequi maiores eius vitae ut.,Admin,5/29/2019 8:23
at,Possimus consequuntur voluptatem eos eum.,User 7,5/29/2019 8:23
quibusdam,Inventore delectus eos quibusdam facilis.,User 8,5/29/2019 8:23
veniam,Et et expedita delectus.,User 5,5/29/2019 8:23
deleniti,Aspernatur nostrum fuga autem alias earum quis.,User1,5/29/2019 8:23
voluptatem,Optio qui reiciendis dolorem est omnis aut.,User 5,5/29/2019 8:23
sed,Consectetur voluptatem rem rerum nostrum.,User 5,5/29/2019 8:23
quasi,Totam totam illo magnam repudiandae.,Admin,5/29/2019 8:23
quo,Itaque error veritatis commodi.,Admin,5/29/2019 8:23
nemo,Asperiores ullam voluptatem est nulla facilis quia.,User 3,5/29/2019 8:23
placeat,Repellendus nam quisquam unde consequuntur sit consequatur.,User 6,5/29/2019 8:23
qui,Natus animi quos blanditiis saepe eveniet nobis.,Admin,5/29/2019 8:23
ut,Saepe blanditiis qui distinctio nihil sunt sunt temporibus dignissimos.,User 2,5/29/2019 8:23
cum,Sit animi sapiente totam molestias pariatur.,User 3,5/29/2019 8:23
in,Sed nulla optio quia distinctio.,User 4,5/29/2019 8:23
numquam,Aliquam aspernatur voluptatum nam commodi architecto est.,User 2,5/29/2019 8:23
aut,Quod quidem et dolorem.,User 3,5/29/2019 8:22
deleniti,Totam iste corrupti placeat nostrum et totam soluta.,User 3,5/29/2019 8:21
deserunt,Nam qui veritatis ea tenetur quis earum.,User1,5/29/2019 8:21
illum,Nemo ratione debitis sunt dolorem.,User 6,5/29/2019 8:21
est,Ea quis doloremque similique.,User 6,5/29/2019 8:21
enim,Vel fuga beatae officiis a voluptate.,User1,5/29/2019 8:21
error,Sit debitis dignissimos reiciendis accusantium voluptatibus molestias illum.,User 6,5/29/2019 8:21
error,Vel dignissimos consectetur eaque natus doloremque sapiente praesentium.,User 7,5/29/2019 8:21
reiciendis,Commodi aspernatur fuga laudantium provident quo consequatur.,User1,5/29/2019 8:21
minus,Hic fugiat dolor id.,User 7,5/29/2019 8:21
ipsum,Enim temporibus cumque iure minus laborum.,Admin,5/29/2019 8:21
et,Quo enim quasi nulla nam rerum nihil quo.,User 2,5/29/2019 8:21
reiciendis,Sit vel modi officia nisi enim exercitationem et.,User1,5/29/2019 8:21
id,Voluptatem rem atque odio aspernatur voluptas.,User 2,5/29/2019 8:21
debitis,Aut quas quia repellat.,User 7,5/29/2019 8:21
aut,Fuga vel quaerat maxime non dolor deleniti quia.,User 8,5/29/2019 8:21
illum,Provident beatae dolorem minima natus.,User 8,5/29/2019 8:21
a,Quia ut similique ab ipsam et labore tempore.,User 3,5/29/2019 8:21
aut,Modi aut excepturi saepe quia quibusdam suscipit.,User 5,5/29/2019 8:21
fugit,Accusantium quod est amet debitis.,Admin,5/29/2019 8:21
illum,Possimus sit eius unde beatae perspiciatis nam.,User1,5/29/2019 8:21
consequatur,Id fugiat ea illo libero quaerat vel fugiat.,User 6,5/29/2019 8:21
aperiam,Officiis dolore voluptas nam iusto doloremque recusandae.,User 2,5/29/2019 8:21
harum,Beatae vel repudiandae nesciunt exercitationem quos culpa laudantium in.,User 7,5/29/2019 8:21
corrupti,Incidunt quo similique nulla ipsum.,Admin,5/29/2019 8:21
vel,Architecto provident quo sint temporibus.,Admin,5/29/2019 8:21
qui,Aut voluptatibus accusamus corporis laudantium nulla qui.,User1,5/29/2019 8:21
sequi,Autem possimus qui dolorem quia.,User1,5/29/2019 8:21
adipisci,Ut et quaerat debitis ut.,Admin,5/29/2019 8:21
mollitia,Ut est omnis accusantium voluptas consequuntur voluptates sunt.,User 5,5/29/2019 8:21
amet,Voluptatem consequatur accusamus et itaque.,User 4,5/29/2019 8:21
molestiae,Eveniet ea repudiandae est.,User1,5/29/2019 8:21
minima,Vitae ut qui ut at similique voluptatibus quia.,User 3,5/29/2019 8:21
fugiat,Quis dolor necessitatibus enim ducimus nihil.,User 2,5/29/2019 8:21
deserunt,Voluptas esse voluptatem sit voluptas reiciendis.,User 4,5/29/2019 8:21
autem,Et nulla ut non sit commodi temporibus.,User 8,5/29/2019 8:21
inventore,Atque fuga et consectetur adipisci.,User 7,5/29/2019 8:21
corrupti,Mollitia consequatur laudantium adipisci qui enim.,User 6,5/29/2019 8:21
voluptatum,Officiis recusandae consequatur sed eum assumenda.,User 8,5/29/2019 8:21
voluptatem,Enim eius iste tenetur saepe libero.,Admin,5/29/2019 8:21
sequi,Vel reprehenderit blanditiis ea earum modi molestias blanditiis.,User 8,5/29/2019 8:21
aut,Vel minima assumenda consectetur sequi.,User1,5/29/2019 8:21
enim,Similique ut tempora in non.,User 8,5/29/2019 8:21
distinctio,Velit excepturi sed similique non.,User1,5/29/2019 8:21
